publish_order,page_key,canonical_url,status,final_title,final_h1,meta_description,first_screen_answer,primary_cta,secondary_cta,internal_link_notes,measurement_key
1,country_code_1058,https://www.biyapay.com/en/blogdetail/1058-telephone-area-codes-in-mexico-country-code-52-sim,ready_to_publish_after_editor_review,+52 Country Code: How to Call Mexico and Avoid Common Dialing Mistakes,+52 Country Code: How to Call Mexico from Abroad,"+52 is the country code for Mexico. Learn the correct dialing format, common mistakes with Mexican phone numbers, and what to check before calling from abroad.","+52 is the country code for Mexico. To call Mexico from abroad, use your international access code, +52, and the local number in the correct format.",Check cross-border tools,View rate/converter tool,Country tools; converter page; cross-border transfer explainer; product entry page,country_code_1058
2,boa_1054,https://www.biyapay.com/en/blogdetail/1054-what-is-the-withdrawal-limit-of-bank-of-america-at,ready_to_publish_after_editor_review,"Bank of America ATM Withdrawal Limit: Daily Caps, Fees, and Overseas Use","Bank of America ATM Withdrawal Limit: Daily Caps, Fees, and Overseas Use","Bank of America ATM withdrawal limits depend on account type and ATM rules. See daily caps, foreign ATM fees, and better options for moving money abroad.","Bank of America ATM withdrawal limits vary by account, card type, and machine rules. Before taking cash out, check the daily cap, fees, and overseas withdrawal cost.",Compare fees and check live rate,Start transfer,Compare page; converter page; sendmoney corridor page; download page,boa_1054
3,wechat_2572,https://www.biyapay.com/en/blogdetail/2572-wechat-realname-authentication-how-overseas-users,ready_to_publish_after_editor_review,WeChat Real Name Verification: How Overseas Users Can Complete It,WeChat Real Name Verification for Overseas Users,"Learn how overseas users can complete WeChat real name verification, what documents are accepted, why verification fails, and what payment limits may still apply.","Overseas users can complete WeChat real name verification, but the required steps may differ by region and document type. Check accepted documents and common failure reasons first.",Compare cross-border payment options,Download app,Payment comparison page; transfer route page; converter page; download page,wechat_2572
4,chase_1071,https://www.biyapay.com/en/blogdetail/1071-what-is-the-withdrawal-limit-of-chase-and-can-it-b,publish_after_overlap_review,"Chase ATM Withdrawal Limit: Daily Caps, Fees, and How to Increase It","Chase ATM Withdrawal Limit: Daily Caps, Fees, and How to Increase It","Learn how the Chase ATM withdrawal limit works, what affects your daily cap, what fees may apply, and when to compare transfer costs instead of using cash.","The Chase ATM withdrawal limit is not one fixed number for every customer. It depends on your account, ATM network, and whether you are withdrawing in the U.S. or abroad.",Compare fees and check live rate,Download app,Own main Chase ATM withdrawal limit anchors; link to 2320 as account/card rules explainer,chase_1071
hold,chase_2320,https://www.biyapay.com/en/blogdetail/2320-how-the-chase-withdrawal-limit-works-for-your-acco,hold_major_rewrite_until_1071_review,"How the Chase Withdrawal Limit Works by Account, Card, and ATM","How the Chase Withdrawal Limit Works by Account, Card, and ATM","See how Chase withdrawal limits can vary by account, card type, ATM network, and travel context, plus when another transfer option may cost less.","Chase withdrawal limits can change by account, card, and ATM network. Use this page to understand why your limit may differ from another Chase customer.",Compare fees and check live rate,Start transfer,Do not own main Chase ATM withdrawal limit anchors; support 1071 with account/card/rules anchors,chase_2320
