publish_order,page_key,url,language,pair,query_focus,final_title,final_h1,meta_description,first_screen_answer,primary_cta,secondary_cta,internal_link_notes,baseline_impressions,baseline_ctr,baseline_avg_position,estimated_click_uplift,status,measurement_window
1,converter_jpy_hkd,https://www.biyapay.com/zh/converter/JPY-HKD-converter,zh,JPY-HKD,"日元兑港元, JPY HKD, 日元换港币",日元兑港元汇率换算：JPY/HKD 实时汇率与金额示例,日元兑港元汇率换算,查看日元兑港元实时汇率，输入金额即可换算 JPY/HKD，并了解手续费、到账金额和跨境换汇注意事项。,输入日元金额即可查看对应港元结果。页面应在首屏展示实时汇率、更新时间、常用金额示例和下一步换汇/转账入口。,查看实时汇率,比较最佳汇率,JPY-USD converter; HKD-USD converter; JPY-HKD compare; Japan/Hong Kong transfer route,18017,0.07,9.23,258,ready_to_publish_after_editor_review,14 and 28 days after publish
2,converter_eur_usd,https://www.biyapay.com/zh/converter/EUR-USD-converter,zh,EUR-USD,"欧元兑美元, EUR USD, 欧元换美元",欧元兑美元汇率换算：EUR/USD 实时汇率与金额示例,欧元兑美元汇率换算,查看欧元兑美元实时汇率，输入金额即可换算 EUR/USD，并了解手续费、到账金额和跨境换汇注意事项。,输入欧元金额即可查看对应美元结果。页面应在首屏展示实时汇率、更新时间、常用金额示例和下一步换汇/转账入口。,查看实时汇率,比较最佳汇率,EUR-USD compare; USD-EUR converter; EUR transfer route; USD tool pages,7825,0.05,9.42,113,ready_to_publish_after_editor_review,14 and 28 days after publish
3,converter_thb_usd,https://www.biyapay.com/zh/converter/THB-USD-converter,zh,THB-USD,"泰铢兑美金, 泰铢兑美元, THB USD",泰铢兑美元汇率换算：THB/USD 实时汇率与金额示例,泰铢兑美元汇率换算,查看泰铢兑美元实时汇率，输入金额即可换算 THB/USD，并了解手续费、到账金额和跨境换汇注意事项。,输入泰铢金额即可查看对应美元结果。页面应在首屏展示实时汇率、更新时间、常用金额示例和下一步换汇/转账入口。,查看实时汇率,比较最佳汇率,THB-USD compare; USD-THB converter; Thailand transfer route; USD converter hub,6863,0.09,8.88,97,ready_to_publish_after_editor_review,14 and 28 days after publish
4,converter_jpy_usd,https://www.biyapay.com/zh/converter/JPY-USD-converter,zh,JPY-USD,"30万日元等于多少美金, 日元兑美元, JPY USD",日元兑美元汇率换算：JPY/USD 实时汇率与金额示例,日元兑美元汇率换算,查看日元兑美元实时汇率，输入金额即可换算 JPY/USD，并快速查看 30万日元等于多少美元等常用金额。,输入日元金额即可查看对应美元结果。首屏应提供实时汇率、更新时间、常用金额 chips，并突出 30万日元等常见查询。,查看实时汇率,比较最佳汇率,JPY-USD compare; USD-JPY converter; JPY-HKD converter; Japan transfer route,6420,0.08,8.96,91,ready_to_publish_after_editor_review,14 and 28 days after publish
5,converter_php_usd,https://www.biyapay.com/zh/converter/PHP-USD-converter,zh,PHP-USD,"1比索等于多少美元, 菲律宾比索兑美元, PHP USD",菲律宾比索兑美元汇率换算：PHP/USD 实时汇率与金额示例,菲律宾比索兑美元汇率换算,查看菲律宾比索兑美元实时汇率，输入金额即可换算 PHP/USD，并快速查看 1 比索等于多少美元等常用金额。,输入菲律宾比索金额即可查看对应美元结果。首屏应提供实时汇率、更新时间、常用金额 chips，并覆盖 1 比索等常见查询。,查看实时汇率,比较最佳汇率,PHP-USD compare; USD-PHP converter; Philippines transfer route; USD converter hub,4356,0.07,8.89,62,ready_to_publish_after_editor_review,14 and 28 days after publish
6,converter_aed_pkr,https://www.biyapay.com/en/converter/AED-PKR-converter,en,AED-PKR,"AED to PKR, Dirham to Pakistan Rupee, UAE dirham to PKR",AED to PKR Converter: Live Dirham to Pakistan Rupee Rate,AED to PKR Converter,"Convert AED to PKR with live exchange rate, common amount examples, fee context, and transfer options for UAE dirham to Pakistan rupee.","Enter an AED amount to see the latest PKR result. The first screen should show live rate, update time, common amounts, fee context, and the next transfer action.",Check Live Rate,Compare Best Rate,AED-PKR compare; PKR-AED converter; UAE to Pakistan transfer route; AED/PKR related pairs,3748,0.03,9.45,55,ready_to_publish_after_editor_review,14 and 28 days after publish
